timestamp,subreddit,title,upvotes,comments,sentiment,sentiment_label
2025-03-21 00:00:51,cryptocurrency,"Daily Crypto Discussion - March 21, 2025 (GMT+0)",1,2,0.0,Neutral
2025-03-21 00:02:28,bitcoin,Bitcoin Is In the 2025 Ultimate Crypto Tournament! Facing Immutable in the 1st Round. Underway now!,2,0,0.0,Neutral
2025-03-21 00:13:11,cryptocurrency,Bitcoin's security budget has declined 54% over the past 4 years - Addressing Bitcoin's long-term security problem,1,0,0.2732,Positive
2025-03-21 00:37:26,cryptocurrency,The first crypto.com scam was worse than you realize. They STOLE over 99% of all tokens from Monaco holders. No that's not a typo they stole over 99% of CRO tokens.,7,3,-0.8402,Negative
2025-03-21 00:53:08,bitcoin,The Imminent Restructuring of the Monetary System (& a New Bretton Woods with Bitcoin),1,0,0.0,Neutral
2025-03-21 00:48:07,bitcoin,Next Decade all about bitcoin + AI + Robots,1,0,0.0,Neutral
2025-03-21 01:19:40,cryptocurrency,Aussies Beware: How Sophisticated Crypto Text Scams Are Plaguing Australian Investors,1,2,-0.0516,Negative
2025-03-21 01:32:14,bitcoin,How safe are private keys in the long run?,1,1,0.4404,Positive
2025-03-21 01:37:45,bitcoin,Advocating for Bitcoin,3,2,0.0,Neutral
2025-03-21 01:37:27,bitcoin,Why KYC in non KYC exchanges?,1,0,0.0,Neutral
2025-03-21 01:51:46,bitcoin,Part 1: Trading Mindset – The Key to Success in the Financial Market (Crypto),0,0,0.5719,Positive
2025-03-21 01:51:10,bitcoin,Lol I'm glad because that is the last time for me in futures,0,0,0.7003,Positive
2025-03-21 01:48:32,bitcoin,Part 1: Trading Mindset – The Key to Success in the Financial Market (Crypto),0,0,0.5719,Positive
2025-03-21 01:48:09,bitcoin,Why KYC on non KYC exchanges?,0,2,0.0,Neutral
2025-03-21 01:55:47,cryptomarkets,Aussies Beware: How Sophisticated Crypto Text Scams are Plaguing Australian Investors,2,0,-0.0516,Negative
2025-03-21 02:17:20,cryptocurrency,Bitcoin price thaws after Trump statement — Trader says ‘stay nimble and cashed up’,1,0,0.0,Neutral
2025-03-21 02:11:09,bitcoin,This just in: Grass is green!!,6,0,0.0,Neutral
2025-03-21 02:10:30,bitcoin,For those 100% in bitcoin. Do u have a plan to diversify?,0,1,0.0,Neutral
2025-03-21 02:19:44,cryptocurrency,I want to buy crypto so I can get unreleased carti,0,2,0.0772,Positive
2025-03-21 02:45:24,bitcoin,"Grandpa died, book with codes Update 2",1,0,-0.5574,Negative
2025-03-21 02:56:31,cryptomarkets,Voucher,1,0,0.0,Neutral
2025-03-21 03:02:58,bitcoin,do you have to buy bitcoin to receive money on cash app,1,0,0.0,Neutral
2025-03-21 03:38:46,cryptocurrency,🚀 FREE $99 Crypto Trading Toolkit – AI Trading Bot + Wallet Tracker! 🔥,1,0,0.6514,Positive
2025-03-21 03:33:49,cryptocurrency,"Several new features including Cashback  went live for Yoroi Wallet - ""Shop online with any card. Get cashback in ADA.""",0,1,0.0,Neutral
2025-03-21 03:29:06,bitcoin,This book argues governments might actually want Bitcoin to succeed. Crazy or possible?,5,0,-0.128,Negative
2025-03-21 04:11:30,cryptocurrency,Video for coin,1,1,0.0,Neutral
2025-03-21 04:15:23,bitcoin,Bitcoin taxes?,0,0,0.0,Neutral
2025-03-21 04:13:14,bitcoin,Crypto video costs,1,0,0.0,Neutral
2025-03-21 04:19:58,bitcoin,paper wallets?,1,0,0.0,Neutral
2025-03-21 04:35:04,cryptocurrency,"Bad news Bitcoin bulls, the long-hoped-for retail is already here: CryptoQuant",1,0,-0.5423,Negative
2025-03-21 04:40:58,bitcoin,what about satoshis bitcoins?,0,5,0.0,Neutral
2025-03-21 04:52:24,bitcoin,How Long Until,1,0,0.0,Neutral
2025-03-21 05:50:24,cryptocurrency,Me vs The Market,1,0,0.0,Neutral
2025-03-21 06:02:34,bitcoin,"Daily Discussion, March 21, 2025",2,0,0.0,Neutral
2025-03-21 06:09:48,bitcoin,"NEW:Former Navy Fighter Pilot says he has all of his wealth in #Bitcoin and how it is the biggest hope for ending wars created from printing money.  🔥

""How can you fight a war for 20 years? How can you spend $6 Trillion? You can only do it one way, you can just print money."" 🖨️",1,0,-0.4137,Negative
2025-03-21 06:29:11,bitcoin,Still Accumulating Altcoins,2,0,0.0,Neutral
2025-03-21 06:45:48,cryptocurrency,"Utah’s Blockchain Bullion Bombshell: Gold, Silver, and a Digital Revolution",1,0,0.0,Neutral
2025-03-21 06:46:38,cryptomarkets,Sponsored a boxing match with Joe Giannetti,1,0,0.0,Neutral
2025-03-21 07:27:29,cryptocurrency,Australia Wants to Integrate Crypto Into the Economy in New White Paper,2,0,0.0,Neutral
2025-03-21 07:36:26,cryptomarkets,Are you still accumulating?,1,0,0.0,Neutral
2025-03-21 08:05:23,cryptocurrency,ETH mega pump coming? Ether on exchanges falls to near-decade low,3,2,-0.2732,Negative
2025-03-21 08:22:42,bitcoin,If I buy Bitcoin from 2 different accounts on an exchange 1 kyc and 1 non kyc and send the bitcoin to the same hardware wallet using different receiving addresses would the government know how much BTC I have in the wallet or just or just what I’ve received using kyc?,1,0,0.0,Neutral
2025-03-21 08:43:17,bitcoin,The God of Dreams,1,0,0.5859,Positive
2025-03-21 08:20:30,bitcoin,https://www.binance.com/activity/trading-competition/bootcamp25-spot-roi,2,0,0.0,Neutral
2025-03-21 09:00:36,bitcoin,Chat_129 - Building the UX Last Mile with UTXO,1,0,0.0,Neutral
2025-03-21 09:05:54,cryptomarkets,Who else see that BURGER 🍔 Coin? Today,0,0,0.0,Neutral
2025-03-21 09:45:08,cryptocurrency,More Ways To Earn COTI,1,0,0.0,Neutral
2025-03-21 09:43:19,cryptocurrency,Becoming a Crypto Millionaire – Still Possible or Mission Impossible?,1,0,0.0,Neutral
2025-03-21 09:53:04,cryptocurrency,Bitcoin News: North Korea-Linked Lazarus Group Holds More BTC Than Elon Musk's Tesla,0,1,0.0,Neutral
2025-03-21 10:13:19,cryptomarkets,"Lets be honest people, we win and we lose sometimes. This time we lost :)",2,0,0.7269,Positive
2025-03-21 10:21:47,bitcoin,"Bitcoin’s Official ISO Domain, XBT.com hits the auction block at Lloyds, attracting huge media attention",0,0,0.3612,Positive
2025-03-21 10:31:02,cryptocurrency,Hyperliquid Whale Outed as Serial Scammer,2,0,0.0,Neutral
2025-03-21 10:35:57,cryptomarkets,"Trump launches his own crypto exchange, this could be the big moment.",1,0,0.0,Neutral
2025-03-21 10:28:19,cryptomarkets,USDT sent by mistake,1,0,-0.34,Negative
2025-03-21 10:51:41,bitcoin,found a bitcoin keychain in the local recycling center and the staff there let me take it for free,3,2,0.5106,Positive
2025-03-21 10:56:12,bitcoin,How many of you are actually using a 20 words private key as per SLIP39?,1,0,0.0,Neutral
2025-03-21 10:52:49,bitcoin,Repost,1,0,0.0,Neutral
2025-03-21 11:05:36,bitcoin,Detailed macro-economic analysis into the upcoming bull run,1,0,0.0,Neutral
2025-03-21 11:00:36,cryptomarkets,"Daily Discussion Megathread - March 21, 2025 (GMT+0)",1,0,0.0,Neutral
2025-03-21 11:00:43,cryptomarkets,April Fools Pump,3,0,-0.4939,Negative
2025-03-21 11:14:38,cryptocurrency,"Another popular crypto X account hacked, spreads fake Ripple-SWIFT partnership news",1,0,-0.4588,Negative
2025-03-21 11:07:48,cryptomarkets,Where can I find unbiased news and infos about coins?,1,0,-0.0258,Negative
2025-03-21 11:18:11,cryptocurrency,Meet The Co-Creator of XRP/Ripple Protocol Who Is Using His Crypto Fortune To Fund A $1B Space Station!,3,2,0.0,Neutral
2025-03-21 11:20:51,bitcoin,Buy at the sound of cannons and sell at the sound of violins.,4,0,0.0,Neutral
2025-03-21 11:26:08,bitcoin,NEW: 🇺🇸 Publicly traded Atai Life Sciences to stack $5 million in Bitcoin,1,0,0.0,Neutral
2025-03-21 11:24:26,bitcoin,The investor is forever torn between regretting not buying more and regretting buying too much.,1,0,-0.7506,Negative
2025-03-21 11:17:32,bitcoin,Title: Is it possible to mine Bitcoin solo and in a pool simultaneously?,1,2,0.0,Neutral
2025-03-21 11:29:07,cryptocurrency,KULR Technology's Bitcoin Treasury Strategy: An In-Depth Analysis,0,1,0.2023,Positive
2025-03-21 11:33:00,bitcoin,"Questions for Bitcoiners. Will buying bitcoin for the next 20-30 years, say £500 pm, make someone rich or will it just put them ahead of everyone else if it becomes a world currency?",1,0,0.5574,Positive
2025-03-21 11:44:19,cryptocurrency,"25 years ago today, Michael Saylor lost $6 billion in a single day 💀",1,0,-0.3182,Negative
2025-03-21 11:53:02,bitcoin,"Stop trying to get rich from Bitcoin, it will make life a lot more comfortable for you",0,2,0.7178,Positive
2025-03-21 11:49:28,bitcoin,Hedge Fund Strategy in BTC,1,0,0.0,Neutral
2025-03-21 12:08:18,bitcoin,This thread is a dumpster fire,2,2,-0.4588,Negative
2025-03-21 12:17:57,cryptomarkets,📣 SEC to hold first crypto regulation roundtable today at 17:00 UTC,1,0,0.0,Neutral
2025-03-21 12:22:26,bitcoin,📣 SEC to hold first crypto regulation roundtable today at 17:00 UTC,1,0,0.0,Neutral
2025-03-21 12:30:16,bitcoin,"Yes, I buy BTC every month.",6,0,0.4019,Positive
2025-03-21 12:36:40,bitcoin,Should you diversify into something other than Bitcoin?,1,0,0.0,Neutral
2025-03-21 12:38:35,bitcoin,The Acceleration of Hyperbitcoinization: A Financial Revolution Unfolding!,0,1,0.0,Neutral
2025-03-21 12:46:56,cryptomarkets,Why are so many freaking out and sentient down ? It’s too much.,1,0,-0.4728,Negative
2025-03-21 12:53:31,bitcoin,Global M2 is rising. Have you bought enough cheap Bitcoin?,6,4,0.0,Neutral
2025-03-21 13:03:02,bitcoin,"Xapo Bank Launches Bitcoin-Backed Loans, Up to $1 Million Cash",1,0,0.0,Neutral
2025-03-21 13:01:37,bitcoin,Can I get scammed from this?,1,0,0.0,Neutral
2025-03-21 13:11:50,bitcoin,River BTC Spread Question...,1,0,0.0,Neutral
2025-03-21 13:38:52,bitcoin,How can I transfer crypto from Binance to revolut x?,1,0,0.0,Neutral
2025-03-21 13:44:21,bitcoin,HODL,4,1,0.0,Neutral
2025-03-21 13:40:30,bitcoin,Strategy Raises $711M to Buy More Bitcoin in Upsized STRF Perpetual Offering,1,0,0.0,Neutral
2025-03-21 13:57:29,bitcoin,Fun fact,1,0,0.5106,Positive
2025-03-21 14:04:42,bitcoin,"""WE ACCEPT BITCOIN"". /SID, 2022.",2,0,0.516,Positive
2025-03-21 14:00:51,bitcoin,Macro Weakness Weighing on Bitcoin,2,0,-0.4215,Negative
2025-03-21 14:28:11,bitcoin,BULLRUN 2025 🚀 Read below and answer.,1,0,0.0,Neutral
2025-03-21 14:27:45,bitcoin,Mine with USB(or am I tripping?),0,0,0.0,Neutral
2025-03-21 14:49:14,cryptocurrency,KULR Technology's Bitcoin Treasury Strategy: An In-Depth Analysis,1,1,0.2023,Positive
2025-03-21 14:46:31,bitcoin,Where should I buy Bitcoin?,3,1,0.0,Neutral
2025-03-21 14:50:36,bitcoin,Kim Jong Un hacks unsecure sh*tcoins and then dumps them for bitcoin,0,0,-0.4019,Negative
2025-03-21 14:50:30,bitcoin,"Investing in renewable energy in a new way – is the market ready?""",1,0,0.2732,Positive
2025-03-21 14:43:33,cryptomarkets,"Pi Coin Price Breaks Down, Slipping Below $1: Next Stop At $0.6?",1,1,-0.296,Negative
2025-03-21 14:52:17,bitcoin,1 whole-fucking-coiner!,15,3,0.0,Neutral
2025-03-21 14:51:20,bitcoin,Once the MAG 7 adopts bitcoin the rest fall like dominoe's,4,0,0.4939,Positive
2025-03-21 15:09:13,cryptocurrency,"US Treasury removes Tornado Cash addresses from blacklist, maintains sanctions on developer",1,0,0.2023,Positive
2025-03-21 15:07:30,cryptocurrency,Singaporean Tokens,1,0,0.0,Neutral
2025-03-21 15:09:59,bitcoin,Bitcoin: A Once-in-a-Lifetime Opportunity – Why You Should Act Now!,1,0,0.7088,Positive
2025-03-21 15:07:55,bitcoin,am i dumb,1,1,-0.5106,Negative
2025-03-21 15:19:24,cryptocurrency,US Treasury Removes Sanctions on Tornado Cash – Regulation Bitcoin News,1,0,0.2023,Positive
2025-03-21 15:15:29,cryptomarkets,Singaporean Tokens,1,0,0.0,Neutral
2025-03-21 15:25:00,cryptocurrency,Strategy Ups ‘Strife’ Offering to $723 Million to Buy More,2,1,0.0,Neutral
2025-03-21 15:31:30,cryptocurrency,"Kris claims crypto.com is profitable and ""ran in a very efficient way"" but doesn't say why they needed to print and give $5B USD in CRO to cover their ""future expenses"". Meaning at best crypto.com scammed CRO holders, at worst crypto.com is secretly insolvent.",1,0,0.4848,Positive
2025-03-21 15:34:13,bitcoin,How much fiat money do you have in relation with Bitcoin?,2,4,0.0,Neutral
2025-03-21 15:54:39,cryptocurrency,Blockchain and post quantum cryptography webinar: Interested people can register,1,0,0.4019,Positive
2025-03-21 15:53:02,bitcoin,"Evelyn Lemus: ""Take Action; Talk About Bitcoin, Teach About Bitcoin, Use Bitcoin""",2,0,0.0,Neutral
2025-03-21 16:07:35,bitcoin,How do I recover my bitcoin,1,0,0.0,Neutral
2025-03-21 16:06:54,bitcoin,Government Ownership Already at 3-6% of BTC,1,1,0.0,Neutral
2025-03-21 16:14:06,cryptocurrency,"BlackRock acquires $172.1M in Bitcoin, strengthening institutional dominance",3,1,0.6124,Positive
2025-03-21 16:29:38,cryptocurrency,Is This Cycle the Great Crypto Reset?,1,1,0.6249,Positive
2025-03-21 16:27:45,cryptocurrency,The Hilarious & Wild HEX/PulseChain Saga Unfolding Right Now,1,1,0.4019,Positive
2025-03-21 16:27:37,bitcoin,Shares to BTC??,2,1,0.3736,Positive
2025-03-21 16:30:53,bitcoin,Tap-to-pay with CashuBTC ecash — for Bitcoin (more details in the comments).,1,1,0.0,Neutral
2025-03-21 16:34:52,cryptomarkets,MetalCore / MCG,1,0,0.0,Neutral
2025-03-21 16:58:45,bitcoin,👀,1,0,0.0,Neutral
2025-03-21 17:13:38,bitcoin,many years ago I bought full bitcoin at £7000 having  o knowledge. I sold it as spoke to crypto guru,1,0,0.0,Neutral
2025-03-21 17:11:57,bitcoin,Selling gold and buying bitcoin is a budget neutral way the US government could acquire bitcoin.,1,0,0.0,Neutral
2025-03-21 17:05:40,cryptomarkets,"Xandeum introduces pNodes, a storage scaling solution on Solana",1,0,0.3182,Positive
2025-03-21 17:14:05,bitcoin,The only chart I look at for BTC.,4,2,0.0,Neutral
2025-03-21 17:33:58,cryptocurrency,wrench attack from CPAs / tax preper,1,0,-0.4767,Negative
2025-03-21 17:33:16,bitcoin,Which is the best place to buy BTC and the best wallet to store them?,1,0,0.8555,Positive
2025-03-21 17:31:18,bitcoin,wrench attack from CPAs / tax preper,1,0,-0.4767,Negative
2025-03-21 17:26:32,bitcoin,Bitcoin Optech Newsletter #346,1,0,0.0,Neutral
2025-03-21 17:43:25,bitcoin,"ARKHAM ALERT: BLACKROCK IS BUYING BITCOIN

BLACKROCK HAS JUST RECEIVED $145M $BTC",1,0,0.296,Positive
2025-03-21 17:41:46,crypto,How does 0-RTT TLS 1.3 determine whether to accept or reject early data?,1,0,-0.0258,Negative
2025-03-21 17:41:25,cryptomarkets,"Solid sideways this week, what next?",1,0,0.1531,Positive
2025-03-21 17:54:03,cryptomarkets,1000x coin is a scam,1,0,-0.5719,Negative
2025-03-21 17:48:18,cryptomarkets,"Use In Editing in Project - 25 Grok’s image Editing Prompts, Grok Released Image edit feature —check out what I tried!",0,0,0.0,Neutral
2025-03-21 18:00:17,cryptocurrency,Tornado Cash token soars 71% after removal from US sanctions list,2,1,0.0,Neutral
2025-03-21 17:54:56,bitcoin,"JUST IN: 🇺🇸 Publicly traded Atai Life Sciences to buy $5 million in #Bitcoin

Nothing stops this train 🙌",3,0,0.1139,Positive
2025-03-21 17:55:07,bitcoin,Your Daily Bitcoin Breakdown newsletter is now live. Check out today’s Top Stories and a sneak peek at the latest Quick Bits snippets. Full issue link is in the comments.,2,1,0.2023,Positive
2025-03-21 18:08:43,bitcoin,We are so early,2,0,0.0,Neutral
2025-03-21 15:35:56,bitcoin,Polymarket Bitcoin SBR odds?,2,1,0.0,Neutral
2025-03-21 18:20:54,cryptocurrency,Gov’t can realize gains on gold certificates to buy Bitcoin: Bo Hines,1,1,0.34,Positive
2025-03-21 18:36:10,bitcoin,I'll keep stacking,2,0,0.0,Neutral
2025-03-21 18:41:12,bitcoin,The only bitcoin I can afford lol.  Silver,1,0,0.4215,Positive
2025-03-21 18:39:56,finance,Fixing the Fracture: Reforming fragmented US banking regulation,1,1,0.0,Neutral
2025-03-21 18:56:14,crypto,Cloudflare blog; Prepping for post-quantum: a beginner's guide to lattice cryptography,1,0,0.0,Neutral
2025-03-21 19:08:19,cryptomarkets,Keep or sale?,0,3,0.0,Neutral
2025-03-21 19:18:27,cryptocurrency,A good way to promote a small app project?,1,0,0.6705,Positive
2025-03-21 19:21:29,finance,"I forgot my bring my book to class, sorry.",0,0,-0.0772,Negative
2025-03-21 19:17:02,cryptomarkets,"The shocking truth, 99.99% of crypto is scam: Part 2",0,12,-0.6249,Negative
2025-03-21 19:32:39,bitcoin,Anthony Pompliano: “People are drastically underestimating how maniacal the United States is going to be in buying Bitcoin.” - The starting gun has fired on a global race to accumulate Bitcoin at the sovereign level. The good news for you? Markets haven’t caught on—yet.,7,0,-0.1531,Negative
2025-03-21 19:30:27,bitcoin,It's true?????,2,0,0.0,Neutral
2025-03-21 19:36:02,bitcoin,Node with a N100,1,0,0.0,Neutral
2025-03-21 19:35:52,bitcoin,"If you had an unlimited credit card with no consequences, would you spend wisely? Neither does the government.",1,0,0.4939,Positive
2025-03-21 19:43:43,cryptocurrency,"Fund Manager Says Bitcoin Will Crush Gold, Hit $1 Million By 2029",1,0,-0.1531,Negative
2025-03-21 19:36:43,cryptomarkets,Legitimate News Resources?,1,0,0.0,Neutral
2025-03-21 19:47:35,bitcoin,If I DCA $30 per day....,0,1,0.0,Neutral
2025-03-21 20:05:36,cryptomarkets,Is mexc a good broker,1,0,0.4404,Positive
2025-03-21 20:07:38,cryptocurrency,They Don't Know My ETH Used To Be $5000,32,5,0.0,Neutral
2025-03-21 20:12:47,cryptomarkets,Bitcoin mining,2,1,0.0,Neutral
2025-03-21 20:26:46,cryptocurrency,"used my LTC xpub for doge, can I recover funds?",1,0,0.0,Neutral
2025-03-21 20:26:42,cryptomarkets,Wallet tracking,1,0,0.0,Neutral
2025-03-21 20:25:50,cryptomarkets,Trump Isn’t Pro-Crypto — He’s Just Helping His Friends Get Rich Off It,1,0,0.836,Positive
2025-03-21 20:28:34,bitcoin,DO NOT REDEEEEEEM,20,1,0.0,Neutral
2025-03-21 20:52:31,cryptocurrency,Coinbase in ‘advanced’ talks to acquire Deribit: report,1,0,0.0,Neutral
2025-03-21 20:55:21,cryptomarkets,Please help me!!,1,0,0.6792,Positive
2025-03-21 20:50:28,cryptomarkets,When to get on the train…,1,1,0.0,Neutral
2025-03-21 21:36:50,cryptocurrency,"BCH Gears Up for Bliss 2025 Conference in Slovenia, Network Upgrade in May",1,0,0.5719,Positive
2025-03-21 21:37:18,bitcoin,Real History of the United States,1,0,0.4215,Positive
2025-03-21 21:46:39,bitcoin,Daily buying,2,0,0.0,Neutral
2025-03-21 21:52:21,bitcoin,If only i knew then lol,4,5,0.4215,Positive
2025-03-21 21:59:45,bitcoin,Becoming orange pilled.,2,0,0.0,Neutral
2025-03-21 22:01:37,bitcoin,Is this the MOST BITCOIN-FRIENDLY Destination in Europe?,1,0,0.0,Neutral
2025-03-21 22:24:39,cryptocurrency,Tether taps Big Four firm for audit after years of infamous vagueness,3,2,0.0,Neutral
2025-03-21 22:28:08,cryptocurrency,Bitcoin faces pressure from potential whale selling and weak investor sentiment,1,0,-0.6249,Negative
2025-03-21 22:28:43,bitcoin,"$11.5 Trillion BlackRock Buys 2660 BTC for $218 Million, Labels Bitcoin as Emerging Global Monetary Alternative - ""The Defiant""",1,0,-0.2263,Negative
2025-03-21 22:46:09,bitcoin,Leverage,1,0,0.0,Neutral
2025-03-21 22:50:05,bitcoin,Buy and hold general question,0,0,0.0,Neutral
2025-03-21 23:09:46,cryptocurrency,"Solo Bitcoin Miner Hits the Jackpot, Scoring $266K Reward",1,0,0.5719,Positive
2025-03-21 23:29:18,bitcoin,Do I just HODL?,1,0,0.0,Neutral
2025-03-21 23:30:43,cryptocurrency,US Treasury Lifts Sanctions Against Ethereum Mixer Tornado Cash,1,1,0.2023,Positive
2025-03-21 23:47:42,cryptocurrency,"25%/month gains, NO risk involved!  Is this true? LOL!",0,1,0.6941,Positive
2025-03-21 23:44:09,bitcoin,Bitcoin's dirty secret? Multiple mining pools caught using identical Block Templates,4,2,-0.7003,Negative
2025-03-21 23:47:27,bitcoin,Does anyone feel like a fraud??,3,1,-0.3939,Negative
2025-03-21 23:51:30,bitcoin,Wisdom and Strategy,1,0,0.5267,Positive
2025-03-21 09:34:36,crypto,Lost after PhD in Cryptography,1,0,-0.3182,Negative
2025-03-21 19:35:14,cryptomarkets,Is it possible for my $19500 bag pump to $54000 if altseason occurs?,1,1,0.0,Neutral
2025-03-21 18:39:56,finance,Fixing the Fracture: Reforming fragmented US banking regulation,67,12,0.0,Neutral
2025-03-21 18:56:14,crypto,Cloudflare blog; Prepping for post-quantum: a beginner's guide to lattice cryptography,18,0,0.0,Neutral
2025-03-21 17:41:46,crypto,How does 0-RTT TLS 1.3 determine whether to accept or reject early data?,11,5,-0.0258,Negative
2025-03-21 09:34:36,crypto,Lost after PhD in Cryptography,37,3,-0.3182,Negative
