timestamp,subreddit,title,upvotes,comments,sentiment,sentiment_label
2025-03-30 22:55:18,cryptocurrency,Japan to give crypto assets legal status as financial products,171,9,0.296,Positive
2025-03-30 11:56:28,cryptocurrency,"This developer lost access to $240M in Bitcoin after forgetting his password, after using 8 out of 10 attempts to unlock his IronKey wallet, he faces the possibility of never recovering it.",1044,218,-0.3182,Negative
2025-03-30 19:12:27,cryptocurrency,T-Mobile Hit With $33M SIM Swap Award Over Crypto Theft,100,24,0.5423,Positive
2025-03-30 13:27:02,cryptocurrency,Whale Opens $27.53 Million Leveraged PEPE Long on Hyperliquid,219,39,0.0,Neutral
2025-03-30 09:49:54,cryptocurrency,"34 China Citizens Jailed for $64M Crypto Scam That Tricked 30,000 People",350,46,-0.8176,Negative
2025-03-30 17:29:40,cryptocurrency,Ethereum edges closer to deploying Pectra on mainnet with successful upgrade on Hoodi testnet,71,18,0.5859,Positive
2025-03-30 13:39:27,cryptocurrency,Trump’s trade war pressures crypto market as April 2 tariffs loom,126,61,-0.7964,Negative
2025-03-30 09:26:45,cryptocurrency,Is ETH Dead as an Investment? Analysts Weigh In,165,194,-0.6486,Negative
2025-03-30 01:13:44,cryptocurrency,Green is green,664,23,0.0,Neutral
2025-03-30 14:16:33,cryptocurrency,Commercial Banks Entering Crypto,56,9,0.0,Neutral
2025-03-30 06:43:45,cryptocurrency,Women in 50s emerge as high-net-worth crypto investors,188,45,0.0,Neutral
2025-03-30 15:23:13,cryptocurrency,Binance founder Changpeng Zhao 'CZ' leads crypto community donations for deadly SEA earthquake,34,6,0.0,Neutral
2025-03-30 20:05:24,cryptocurrency,PumpSwap DEX crosses $10 billion in cumulative volume 10 days after launch,9,9,0.0,Neutral
2025-03-30 07:28:04,cryptocurrency,Brazilian VP Advisor: 'A Sovereign Bitcoin Reserve Is in the Public Interest' – Calls BTC the 'Gold of the Internet' for Nation’s Prosperity,81,34,0.4588,Positive
2025-03-30 09:19:37,cryptocurrency,"Hawk Tuah Girl: SEC ends meme coin investigation, 'work is complete'",40,31,0.0,Neutral
2025-03-30 17:10:27,cryptocurrency,Binance debuts centralized exchange to decentralized exchange trades,6,5,0.0,Neutral
2025-03-30 22:05:43,bitcoin,Just chillllll,353,97,0.0,Neutral
2025-03-30 23:00:11,bitcoin,Google BTC chart is broken,171,40,-0.4767,Negative
2025-03-30 18:51:10,bitcoin,BTC talk at work,166,141,0.0,Neutral
2025-03-30 21:16:16,bitcoin,Time for consolidation,87,6,0.0,Neutral
2025-03-30 17:06:07,bitcoin,Pump it 😂,165,5,0.0,Neutral
2025-03-30 13:20:35,bitcoin,On the road to .29 BTC,173,128,0.0,Neutral
2025-03-30 12:06:13,bitcoin,Look where we were just a year ago – Bitcoin adoption keeps pushing us higher!,186,24,0.0,Neutral
2025-03-30 13:30:10,bitcoin,Achieving 1 BTC,101,86,0.0,Neutral
2025-03-30 18:42:21,bitcoin,How to retire early without spending my Bitcoin,38,43,0.0,Neutral
2025-03-30 23:43:13,bitcoin,New to Bitcoin,13,21,0.0,Neutral
2025-03-30 21:36:41,bitcoin,Wouldn't have had a problem with 12 words,19,4,0.3089,Positive
2025-03-30 05:35:35,bitcoin,"Stay true to your roots, but don’t be afraid of change.",262,22,0.2263,Positive
2025-03-30 16:03:05,bitcoin,nearly..,34,3,0.0,Neutral
2025-03-30 08:05:09,bitcoin,That's vada'm talking about,106,2,0.0,Neutral
2025-03-30 20:43:31,bitcoin,Im pretty new and have a question.,10,36,0.4939,Positive
2025-03-30 14:55:05,bitcoin,"I've become bearish long-term US markets, is $IBIT still worth it?",13,18,0.2263,Positive
2025-03-30 13:19:59,bitcoin,Where to buy Bitcoin,14,46,0.0,Neutral
2025-03-30 06:35:52,bitcoin,Don’t understand economy,33,52,0.0,Neutral
2025-03-30 15:16:00,cryptomarkets,Crypto is just gambling,81,157,0.0,Neutral
2025-03-30 16:57:00,cryptomarkets,There is not going to be a pump: The s-word — stagflation — rippling through Wall Street and Main Street,21,40,0.0,Neutral
2025-03-30 20:09:10,cryptomarkets,XRP vs ZEC. If you could only hold one.,0,10,0.0,Neutral
2025-03-30 10:13:44,cryptomarkets,LUKSO’s Dev Playground Is Open: Join Hack The Grid — a $150K LYX Builder Challenge,5,0,0.3612,Positive
2025-03-30 12:33:40,cryptomarkets,What crypto do you think has the most institutional interest/adoption?,3,29,0.0,Neutral
2025-03-30 03:55:05,cryptomarkets,Another black Monday?,11,8,0.0,Neutral
2025-03-30 11:17:28,cryptomarkets,📣 Thailand SEC files complaint against OKX for operating without a license,2,1,-0.296,Negative
2025-03-30 19:22:03,cryptomarkets,WhiteRock: The Future of Finance is Here.,0,17,0.0,Neutral
2025-03-30 11:00:41,cryptomarkets,"Daily Discussion Megathread - March 30, 2025 (GMT+0)",0,0,0.0,Neutral
2025-03-30 23:16:28,cryptomarkets,WAKE UP!,0,14,0.0,Neutral
2025-03-30 02:42:39,cryptomarkets,Best Coin for Long-Term DCA?,0,51,0.6369,Positive
2025-03-30 02:24:05,cryptomarkets,Is there a customizable trading dashboard that brings everything into one place?,1,0,0.0,Neutral
2025-03-30 00:40:17,cryptomarkets,I have a question,0,4,0.0,Neutral
